

================================================================
== Vitis HLS Report for 'dct_Pipeline_RD_Loop_Row_RD_Loop_Col'
================================================================
* Date:           Fri Feb 14 09:59:19 2025

* Version:        2024.2 (Build 5238294 on Nov  8 2024)
* Project:        dct_solution3
* Solution:       hls (Vivado IP Flow Target)
* Product family: zynq
* Target device:  xc7z020-clg400-1


================================================================
== Performance Estimates
================================================================
+ Timing: 
    * Summary: 
    +--------+----------+----------+------------+
    |  Clock |  Target  | Estimated| Uncertainty|
    +--------+----------+----------+------------+
    |ap_clk  |  10.00 ns|  6.508 ns|     2.70 ns|
    +--------+----------+----------+------------+

+ Latency: 
    * Summary: 
    +---------+---------+----------+----------+-----+-----+------------------------------------------------+
    |  Latency (cycles) |  Latency (absolute) |  Interval |                    Pipeline                    |
    |   min   |   max   |    min   |    max   | min | max |                      Type                      |
    +---------+---------+----------+----------+-----+-----+------------------------------------------------+
    |       68|       68|  0.680 us|  0.680 us|   65|   65|  loop auto-rewind stp (delay=0 clock cycles(s))|
    +---------+---------+----------+----------+-----+-----+------------------------------------------------+

    + Detail: 
        * Instance: 
        N/A

        * Loop: 
        +---------------------------+---------+---------+----------+-----------+-----------+------+----------+
        |                           |  Latency (cycles) | Iteration|  Initiation Interval  | Trip |          |
        |         Loop Name         |   min   |   max   |  Latency |  achieved |   target  | Count| Pipelined|
        +---------------------------+---------+---------+----------+-----------+-----------+------+----------+
        |- RD_Loop_Row_RD_Loop_Col  |       66|       66|         4|          1|          1|    64|       yes|
        +---------------------------+---------+---------+----------+-----------+-----------+------+----------+

============================================================
+ Verbose Summary: Synthesis Manager
============================================================
InlineROM: 1
ExposeGlobal: 0
============================================================
+ Verbose Summary: CDFG Model
============================================================
IsTopModel: 0
ResetActiveHigh: 1
IsCombinational: 0
IsDatapathOnly: 0
HasWiredReturn: 1
HasMFsm: 2
HasVarLatency: 1
IsPipeline: 0
IsRtlPipelined: 0
IsInstanceOverlapped: 0
IsDontTouch: 0
HasImplIP: 0
IsGatedGlobalClock: 0

+ Individual pipeline summary: 
  * Pipeline-0: initiation interval (II) = 1, depth = 4


============================================================
+ Verbose Summary: Schedule
============================================================
* Number of FSM states : 4
* Pipeline : 1
  Pipeline-0 : II = 1, D = 4, States = { 1 2 3 4 }
* Dataflow Pipeline: 0

* FSM state transitions: 
1 --> 2 
2 --> 3 
3 --> 4 
4 --> 

* FSM state operations: 

State 1 <SV = 0> <Delay = 5.04>
ST_1 : Operation 7 [1/1] (0.00ns)   --->   "%c = alloca i32 1" [E:/robot/project/xilinx_fpga_class/hls/lab3/dct.c:89->E:/robot/project/xilinx_fpga_class/hls/lab3/dct.c:122]   --->   Operation 7 'alloca' 'c' <Predicate = true> <Delay = 0.00>
ST_1 : Operation 8 [1/1] (0.00ns)   --->   "%r = alloca i32 1" [E:/robot/project/xilinx_fpga_class/hls/lab3/dct.c:89->E:/robot/project/xilinx_fpga_class/hls/lab3/dct.c:122]   --->   Operation 8 'alloca' 'r' <Predicate = true> <Delay = 0.00>
ST_1 : Operation 9 [1/1] (0.00ns)   --->   "%indvar_flatten = alloca i32 1"   --->   Operation 9 'alloca' 'indvar_flatten' <Predicate = true> <Delay = 0.00>
ST_1 : Operation 10 [1/1] (0.00ns)   --->   "%specinterface_ln0 = specinterface void @_ssdm_op_SpecInterface, i16 %input_r, void @empty, i32 0, i32 0, void @empty_0, i32 4294967295, i32 0, void @empty_0, void @empty_0, void @empty_0, i32 0, i32 0, i32 0, i32 0, void @empty_0, void @empty_0, i32 4294967295, i32 0, i32 0"   --->   Operation 10 'specinterface' 'specinterface_ln0' <Predicate = true> <Delay = 0.00>
ST_1 : Operation 11 [1/1] (1.58ns)   --->   "%store_ln0 = store i7 0, i7 %indvar_flatten"   --->   Operation 11 'store' 'store_ln0' <Predicate = true> <Delay = 1.58>
ST_1 : Operation 12 [1/1] (1.58ns)   --->   "%store_ln89 = store i4 0, i4 %r" [E:/robot/project/xilinx_fpga_class/hls/lab3/dct.c:89->E:/robot/project/xilinx_fpga_class/hls/lab3/dct.c:122]   --->   Operation 12 'store' 'store_ln89' <Predicate = true> <Delay = 1.58>
ST_1 : Operation 13 [1/1] (1.58ns)   --->   "%store_ln89 = store i4 0, i4 %c" [E:/robot/project/xilinx_fpga_class/hls/lab3/dct.c:89->E:/robot/project/xilinx_fpga_class/hls/lab3/dct.c:122]   --->   Operation 13 'store' 'store_ln89' <Predicate = true> <Delay = 1.58>
ST_1 : Operation 14 [1/1] (0.00ns)   --->   "%br_ln0 = br void %for.inc.i"   --->   Operation 14 'br' 'br_ln0' <Predicate = true> <Delay = 0.00>
ST_1 : Operation 15 [1/1] (0.00ns)   --->   "%indvar_flatten_load = load i7 %indvar_flatten" [E:/robot/project/xilinx_fpga_class/hls/lab3/dct.c:92->E:/robot/project/xilinx_fpga_class/hls/lab3/dct.c:122]   --->   Operation 15 'load' 'indvar_flatten_load' <Predicate = true> <Delay = 0.00>
ST_1 : Operation 16 [1/1] (1.87ns)   --->   "%icmp_ln92 = icmp_eq  i7 %indvar_flatten_load, i7 64" [E:/robot/project/xilinx_fpga_class/hls/lab3/dct.c:92->E:/robot/project/xilinx_fpga_class/hls/lab3/dct.c:122]   --->   Operation 16 'icmp' 'icmp_ln92' <Predicate = true> <Delay = 1.87> <CoreInst = "Cmp">   --->   Core 9 'Cmp' <Latency = 0> <II = 1> <Delay = 1.87> <FuncUnit> <Opcode : 'seteq' 'setne' 'setle' 'setge' 'setlt' 'setgt'> <InPorts = 2> <OutPorts = 1>
ST_1 : Operation 17 [1/1] (1.87ns)   --->   "%add_ln92_1 = add i7 %indvar_flatten_load, i7 1" [E:/robot/project/xilinx_fpga_class/hls/lab3/dct.c:92->E:/robot/project/xilinx_fpga_class/hls/lab3/dct.c:122]   --->   Operation 17 'add' 'add_ln92_1' <Predicate = true> <Delay = 1.87> <CoreInst = "Adder">   --->   Core 1 'Adder' <Latency = 0> <II = 1> <Delay = 1.87> <FuncUnit> <Opcode : 'add' 'sub'> <InPorts = 2> <OutPorts = 1>
ST_1 : Operation 18 [1/1] (0.00ns)   --->   "%br_ln92 = br i1 %icmp_ln92, void %for.inc8.i, void %for.inc.i.i.preheader.exitStub" [E:/robot/project/xilinx_fpga_class/hls/lab3/dct.c:92->E:/robot/project/xilinx_fpga_class/hls/lab3/dct.c:122]   --->   Operation 18 'br' 'br_ln92' <Predicate = true> <Delay = 0.00>
ST_1 : Operation 19 [1/1] (1.58ns)   --->   "%store_ln92 = store i7 %add_ln92_1, i7 %indvar_flatten" [E:/robot/project/xilinx_fpga_class/hls/lab3/dct.c:92->E:/robot/project/xilinx_fpga_class/hls/lab3/dct.c:122]   --->   Operation 19 'store' 'store_ln92' <Predicate = (!icmp_ln92)> <Delay = 1.58>

State 2 <SV = 1> <Delay = 6.08>
ST_2 : Operation 20 [1/1] (0.00ns)   --->   "%c_load = load i4 %c" [E:/robot/project/xilinx_fpga_class/hls/lab3/dct.c:94->E:/robot/project/xilinx_fpga_class/hls/lab3/dct.c:122]   --->   Operation 20 'load' 'c_load' <Predicate = true> <Delay = 0.00>
ST_2 : Operation 21 [1/1] (0.00ns)   --->   "%r_load = load i4 %r" [E:/robot/project/xilinx_fpga_class/hls/lab3/dct.c:92->E:/robot/project/xilinx_fpga_class/hls/lab3/dct.c:122]   --->   Operation 21 'load' 'r_load' <Predicate = true> <Delay = 0.00>
ST_2 : Operation 22 [1/1] (1.73ns)   --->   "%add_ln92 = add i4 %r_load, i4 1" [E:/robot/project/xilinx_fpga_class/hls/lab3/dct.c:92->E:/robot/project/xilinx_fpga_class/hls/lab3/dct.c:122]   --->   Operation 22 'add' 'add_ln92' <Predicate = true> <Delay = 1.73> <CoreInst = "Adder">   --->   Core 1 'Adder' <Latency = 0> <II = 1> <Delay = 1.73> <FuncUnit> <Opcode : 'add' 'sub'> <InPorts = 2> <OutPorts = 1>
ST_2 : Operation 23 [1/1] (1.73ns)   --->   "%icmp_ln94 = icmp_eq  i4 %c_load, i4 8" [E:/robot/project/xilinx_fpga_class/hls/lab3/dct.c:94->E:/robot/project/xilinx_fpga_class/hls/lab3/dct.c:122]   --->   Operation 23 'icmp' 'icmp_ln94' <Predicate = true> <Delay = 1.73> <CoreInst = "Cmp">   --->   Core 9 'Cmp' <Latency = 0> <II = 1> <Delay = 1.73> <FuncUnit> <Opcode : 'seteq' 'setne' 'setle' 'setge' 'setlt' 'setgt'> <InPorts = 2> <OutPorts = 1>
ST_2 : Operation 24 [1/1] (1.02ns)   --->   "%select_ln89 = select i1 %icmp_ln94, i4 0, i4 %c_load" [E:/robot/project/xilinx_fpga_class/hls/lab3/dct.c:89->E:/robot/project/xilinx_fpga_class/hls/lab3/dct.c:122]   --->   Operation 24 'select' 'select_ln89' <Predicate = true> <Delay = 1.02> <CoreInst = "Sel">   --->   Core 73 'Sel' <Latency = 0> <II = 1> <Delay = 1.02> <FuncUnit> <Opcode : 'select'> <InPorts = 3> <OutPorts = 1>
ST_2 : Operation 25 [1/1] (1.02ns)   --->   "%select_ln92 = select i1 %icmp_ln94, i4 %add_ln92, i4 %r_load" [E:/robot/project/xilinx_fpga_class/hls/lab3/dct.c:92->E:/robot/project/xilinx_fpga_class/hls/lab3/dct.c:122]   --->   Operation 25 'select' 'select_ln92' <Predicate = true> <Delay = 1.02> <CoreInst = "Sel">   --->   Core 73 'Sel' <Latency = 0> <II = 1> <Delay = 1.02> <FuncUnit> <Opcode : 'select'> <InPorts = 3> <OutPorts = 1>
ST_2 : Operation 26 [1/1] (0.00ns)   --->   "%trunc_ln97 = trunc i4 %select_ln92" [E:/robot/project/xilinx_fpga_class/hls/lab3/dct.c:97->E:/robot/project/xilinx_fpga_class/hls/lab3/dct.c:122]   --->   Operation 26 'trunc' 'trunc_ln97' <Predicate = true> <Delay = 0.00>
ST_2 : Operation 27 [1/1] (0.00ns)   --->   "%tmp_4 = bitconcatenate i6 @_ssdm_op_BitConcatenate.i6.i3.i3, i3 %trunc_ln97, i3 0" [E:/robot/project/xilinx_fpga_class/hls/lab3/dct.c:97->E:/robot/project/xilinx_fpga_class/hls/lab3/dct.c:122]   --->   Operation 27 'bitconcatenate' 'tmp_4' <Predicate = true> <Delay = 0.00>
ST_2 : Operation 28 [1/1] (0.00ns)   --->   "%zext_ln97 = zext i4 %select_ln89" [E:/robot/project/xilinx_fpga_class/hls/lab3/dct.c:97->E:/robot/project/xilinx_fpga_class/hls/lab3/dct.c:122]   --->   Operation 28 'zext' 'zext_ln97' <Predicate = true> <Delay = 0.00>
ST_2 : Operation 29 [1/1] (1.82ns)   --->   "%add_ln97 = add i6 %tmp_4, i6 %zext_ln97" [E:/robot/project/xilinx_fpga_class/hls/lab3/dct.c:97->E:/robot/project/xilinx_fpga_class/hls/lab3/dct.c:122]   --->   Operation 29 'add' 'add_ln97' <Predicate = true> <Delay = 1.82> <CoreInst = "Adder">   --->   Core 1 'Adder' <Latency = 0> <II = 1> <Delay = 1.82> <FuncUnit> <Opcode : 'add' 'sub'> <InPorts = 2> <OutPorts = 1>
ST_2 : Operation 30 [1/1] (1.73ns)   --->   "%add_ln94 = add i4 %select_ln89, i4 1" [E:/robot/project/xilinx_fpga_class/hls/lab3/dct.c:94->E:/robot/project/xilinx_fpga_class/hls/lab3/dct.c:122]   --->   Operation 30 'add' 'add_ln94' <Predicate = true> <Delay = 1.73> <CoreInst = "Adder">   --->   Core 1 'Adder' <Latency = 0> <II = 1> <Delay = 1.73> <FuncUnit> <Opcode : 'add' 'sub'> <InPorts = 2> <OutPorts = 1>
ST_2 : Operation 31 [1/1] (1.58ns)   --->   "%store_ln89 = store i4 %select_ln92, i4 %r" [E:/robot/project/xilinx_fpga_class/hls/lab3/dct.c:89->E:/robot/project/xilinx_fpga_class/hls/lab3/dct.c:122]   --->   Operation 31 'store' 'store_ln89' <Predicate = true> <Delay = 1.58>
ST_2 : Operation 32 [1/1] (1.58ns)   --->   "%store_ln89 = store i4 %add_ln94, i4 %c" [E:/robot/project/xilinx_fpga_class/hls/lab3/dct.c:89->E:/robot/project/xilinx_fpga_class/hls/lab3/dct.c:122]   --->   Operation 32 'store' 'store_ln89' <Predicate = true> <Delay = 1.58>

State 3 <SV = 2> <Delay = 3.25>
ST_3 : Operation 33 [1/1] (0.00ns)   --->   "%zext_ln97_1 = zext i6 %add_ln97" [E:/robot/project/xilinx_fpga_class/hls/lab3/dct.c:97->E:/robot/project/xilinx_fpga_class/hls/lab3/dct.c:122]   --->   Operation 33 'zext' 'zext_ln97_1' <Predicate = true> <Delay = 0.00>
ST_3 : Operation 34 [1/1] (0.00ns)   --->   "%input_r_addr = getelementptr i16 %input_r, i64 0, i64 %zext_ln97_1" [E:/robot/project/xilinx_fpga_class/hls/lab3/dct.c:97->E:/robot/project/xilinx_fpga_class/hls/lab3/dct.c:122]   --->   Operation 34 'getelementptr' 'input_r_addr' <Predicate = true> <Delay = 0.00>
ST_3 : Operation 35 [2/2] (3.25ns)   --->   "%input_r_load = load i6 %input_r_addr" [E:/robot/project/xilinx_fpga_class/hls/lab3/dct.c:97->E:/robot/project/xilinx_fpga_class/hls/lab3/dct.c:122]   --->   Operation 35 'load' 'input_r_load' <Predicate = true> <Delay = 3.25> <CoreInst = "RAM">   --->   Core 81 'RAM' <Latency = 1> <II = 1> <Delay = 3.25> <Storage> <Opcode : 'load' 'store'> <Ports = 2> <Width = 16> <Depth = 64> <RAM>
ST_3 : Operation 43 [1/1] (1.58ns)   --->   "%ret_ln0 = ret"   --->   Operation 43 'ret' 'ret_ln0' <Predicate = (icmp_ln92)> <Delay = 1.58>

State 4 <SV = 3> <Delay = 6.50>
ST_4 : Operation 36 [1/1] (0.00ns)   --->   "%specloopname_ln0 = specloopname void @_ssdm_op_SpecLoopName, void @RD_Loop_Row_RD_Loop_Col_str"   --->   Operation 36 'specloopname' 'specloopname_ln0' <Predicate = true> <Delay = 0.00>
ST_4 : Operation 37 [1/1] (0.00ns)   --->   "%speclooptripcount_ln0 = speclooptripcount void @_ssdm_op_SpecLoopTripCount, i64 64, i64 64, i64 64"   --->   Operation 37 'speclooptripcount' 'speclooptripcount_ln0' <Predicate = true> <Delay = 0.00>
ST_4 : Operation 38 [1/1] (0.00ns)   --->   "%buf_2d_in_addr = getelementptr i16 %buf_2d_in, i64 0, i64 %zext_ln97_1" [E:/robot/project/xilinx_fpga_class/hls/lab3/dct.c:97->E:/robot/project/xilinx_fpga_class/hls/lab3/dct.c:122]   --->   Operation 38 'getelementptr' 'buf_2d_in_addr' <Predicate = true> <Delay = 0.00>
ST_4 : Operation 39 [1/1] (0.00ns)   --->   "%specpipeline_ln95 = specpipeline void @_ssdm_op_SpecPipeline, i32 4294967295, i32 0, i32 0, i32 0, void @empty_0" [E:/robot/project/xilinx_fpga_class/hls/lab3/dct.c:95->E:/robot/project/xilinx_fpga_class/hls/lab3/dct.c:122]   --->   Operation 39 'specpipeline' 'specpipeline_ln95' <Predicate = true> <Delay = 0.00>
ST_4 : Operation 40 [1/2] ( I:3.25ns O:3.25ns )   --->   "%input_r_load = load i6 %input_r_addr" [E:/robot/project/xilinx_fpga_class/hls/lab3/dct.c:97->E:/robot/project/xilinx_fpga_class/hls/lab3/dct.c:122]   --->   Operation 40 'load' 'input_r_load' <Predicate = true> <Delay = 3.25> <CoreInst = "RAM">   --->   Core 81 'RAM' <Latency = 1> <II = 1> <Delay = 3.25> <Storage> <Opcode : 'load' 'store'> <Ports = 2> <Width = 16> <Depth = 64> <RAM>
ST_4 : Operation 41 [1/1] ( I:3.25ns O:3.25ns )   --->   "%store_ln97 = store i16 %input_r_load, i6 %buf_2d_in_addr" [E:/robot/project/xilinx_fpga_class/hls/lab3/dct.c:97->E:/robot/project/xilinx_fpga_class/hls/lab3/dct.c:122]   --->   Operation 41 'store' 'store_ln97' <Predicate = true> <Delay = 3.25> <CoreInst = "RAM">   --->   Core 81 'RAM' <Latency = 1> <II = 1> <Delay = 3.25> <Storage> <Opcode : 'load' 'store'> <Ports = 2> <Width = 16> <Depth = 64> <RAM>
ST_4 : Operation 42 [1/1] (0.00ns)   --->   "%br_ln94 = br void %for.inc.i" [E:/robot/project/xilinx_fpga_class/hls/lab3/dct.c:94->E:/robot/project/xilinx_fpga_class/hls/lab3/dct.c:122]   --->   Operation 42 'br' 'br_ln94' <Predicate = true> <Delay = 0.00>


============================================================
+ Verbose Summary: Timing violations
============================================================
Target clock period: 10.000ns, clock uncertainty: 2.700ns.

 <State 1>: 5.046ns
The critical path consists of the following:
	'store' operation 0 bit ('store_ln0') of constant 0 on local variable 'indvar_flatten' [7]  (1.588 ns)
	'load' operation 7 bit ('indvar_flatten_load', E:/robot/project/xilinx_fpga_class/hls/lab3/dct.c:92->E:/robot/project/xilinx_fpga_class/hls/lab3/dct.c:122) on local variable 'indvar_flatten' [12]  (0.000 ns)
	'icmp' operation 1 bit ('icmp_ln92', E:/robot/project/xilinx_fpga_class/hls/lab3/dct.c:92->E:/robot/project/xilinx_fpga_class/hls/lab3/dct.c:122) [13]  (1.870 ns)
	'store' operation 0 bit ('store_ln92', E:/robot/project/xilinx_fpga_class/hls/lab3/dct.c:92->E:/robot/project/xilinx_fpga_class/hls/lab3/dct.c:122) of variable 'add_ln92_1', E:/robot/project/xilinx_fpga_class/hls/lab3/dct.c:92->E:/robot/project/xilinx_fpga_class/hls/lab3/dct.c:122 on local variable 'indvar_flatten' [36]  (1.588 ns)

 <State 2>: 6.082ns
The critical path consists of the following:
	'load' operation 4 bit ('c_load', E:/robot/project/xilinx_fpga_class/hls/lab3/dct.c:94->E:/robot/project/xilinx_fpga_class/hls/lab3/dct.c:122) on local variable 'c', E:/robot/project/xilinx_fpga_class/hls/lab3/dct.c:89->E:/robot/project/xilinx_fpga_class/hls/lab3/dct.c:122 [17]  (0.000 ns)
	'icmp' operation 1 bit ('icmp_ln94', E:/robot/project/xilinx_fpga_class/hls/lab3/dct.c:94->E:/robot/project/xilinx_fpga_class/hls/lab3/dct.c:122) [22]  (1.735 ns)
	'select' operation 4 bit ('select_ln89', E:/robot/project/xilinx_fpga_class/hls/lab3/dct.c:89->E:/robot/project/xilinx_fpga_class/hls/lab3/dct.c:122) [23]  (1.024 ns)
	'add' operation 4 bit ('add_ln94', E:/robot/project/xilinx_fpga_class/hls/lab3/dct.c:94->E:/robot/project/xilinx_fpga_class/hls/lab3/dct.c:122) [35]  (1.735 ns)
	'store' operation 0 bit ('store_ln89', E:/robot/project/xilinx_fpga_class/hls/lab3/dct.c:89->E:/robot/project/xilinx_fpga_class/hls/lab3/dct.c:122) of variable 'add_ln94', E:/robot/project/xilinx_fpga_class/hls/lab3/dct.c:94->E:/robot/project/xilinx_fpga_class/hls/lab3/dct.c:122 on local variable 'c', E:/robot/project/xilinx_fpga_class/hls/lab3/dct.c:89->E:/robot/project/xilinx_fpga_class/hls/lab3/dct.c:122 [38]  (1.588 ns)

 <State 3>: 3.254ns
The critical path consists of the following:
	'getelementptr' operation 6 bit ('input_r_addr', E:/robot/project/xilinx_fpga_class/hls/lab3/dct.c:97->E:/robot/project/xilinx_fpga_class/hls/lab3/dct.c:122) [32]  (0.000 ns)
	'load' operation 16 bit ('input_r_load', E:/robot/project/xilinx_fpga_class/hls/lab3/dct.c:97->E:/robot/project/xilinx_fpga_class/hls/lab3/dct.c:122) on array 'input_r' [33]  (3.254 ns)

 <State 4>: 6.508ns
The critical path consists of the following:
	'load' operation 16 bit ('input_r_load', E:/robot/project/xilinx_fpga_class/hls/lab3/dct.c:97->E:/robot/project/xilinx_fpga_class/hls/lab3/dct.c:122) on array 'input_r' [33]  (3.254 ns)
	'store' operation 0 bit ('store_ln97', E:/robot/project/xilinx_fpga_class/hls/lab3/dct.c:97->E:/robot/project/xilinx_fpga_class/hls/lab3/dct.c:122) of variable 'input_r_load', E:/robot/project/xilinx_fpga_class/hls/lab3/dct.c:97->E:/robot/project/xilinx_fpga_class/hls/lab3/dct.c:122 on array 'buf_2d_in' [34]  (3.254 ns)


============================================================
+ Verbose Summary: Binding
============================================================
N/A
* FSMD analyzer results:
  - Output states:
 - Input state : 
  - Chain level:
	State 1
	State 2
	State 3
	State 4


============================================================
+ Verbose Summary: Datapath Resource usage 
============================================================
N/A
