

================================================================
== Vitis HLS Report for 'fir'
================================================================
* Date:           Tue Feb 18 09:34:20 2025

* Version:        2024.2 (Build 5238294 on Nov  8 2024)
* Project:        fir
* Solution:       hls (Vivado IP Flow Target)
* Product family: zynq
* Target device:  xc7z020-clg400-1


================================================================
== Performance Estimates
================================================================
+ Timing: 
    * Summary: 
    +--------+----------+----------+------------+
    |  Clock |  Target  | Estimated| Uncertainty|
    +--------+----------+----------+------------+
    |ap_clk  |  10.00 ns|  5.735 ns|     2.70 ns|
    +--------+----------+----------+------------+

+ Latency: 
    * Summary: 
    +---------+---------+----------+----------+-----+-----+---------+
    |  Latency (cycles) |  Latency (absolute) |  Interval | Pipeline|
    |   min   |   max   |    min   |    max   | min | max |   Type  |
    +---------+---------+----------+----------+-----+-----+---------+
    |       68|       68|  0.680 us|  0.680 us|   69|   69|       no|
    +---------+---------+----------+----------+-----+-----+---------+

    + Detail: 
        * Instance: 
        N/A

        * Loop: 
        N/A

============================================================
+ Verbose Summary: Synthesis Manager
============================================================
InlineROM: 1
ExposeGlobal: 0
============================================================
+ Verbose Summary: CDFG Model
============================================================
IsTopModel: 1
ResetActiveHigh: 1
IsCombinational: 0
IsDatapathOnly: 0
HasWiredReturn: 1
HasMFsm: 0
HasVarLatency: 1
IsPipeline: 0
IsRtlPipelined: 0
IsInstanceOverlapped: 0
IsDontTouch: 0
HasImplIP: 0
IsGatedGlobalClock: 0


============================================================
+ Verbose Summary: Schedule
============================================================
* Number of FSM states : 7
* Pipeline : 0
* Dataflow Pipeline: 0

* FSM state transitions: 
1 --> 2 
2 --> 3 
3 --> 4 
4 --> 5 
5 --> 6 
6 --> 7 
7 --> 

* FSM state operations: 

State 1 <SV = 0> <Delay = 0.00>
ST_1 : Operation 8 [1/1] (0.00ns)   --->   "%acc_2_loc = alloca i64 1"   --->   Operation 8 'alloca' 'acc_2_loc' <Predicate = true> <Delay = 0.00>
ST_1 : Operation 9 [2/2] (2.32ns)   --->   "%shift_reg_load = load i16 57" [E:/robot/project/xilinx_fpga_class/hls/lab4_zynq_z2/fir.c:47]   --->   Operation 9 'load' 'shift_reg_load' <Predicate = true> <Delay = 2.32> <CoreInst = "RAM">   --->   Core 81 'RAM' <Latency = 1> <II = 1> <Delay = 2.32> <Storage> <Opcode : 'load' 'store'> <Ports = 2> <Width = 16> <Depth = 58> <RAM>

State 2 <SV = 1> <Delay = 2.32>
ST_2 : Operation 10 [1/2] ( I:2.32ns O:2.32ns )   --->   "%shift_reg_load = load i16 57" [E:/robot/project/xilinx_fpga_class/hls/lab4_zynq_z2/fir.c:47]   --->   Operation 10 'load' 'shift_reg_load' <Predicate = true> <Delay = 2.32> <CoreInst = "RAM">   --->   Core 81 'RAM' <Latency = 1> <II = 1> <Delay = 2.32> <Storage> <Opcode : 'load' 'store'> <Ports = 2> <Width = 16> <Depth = 58> <RAM>

State 3 <SV = 2> <Delay = 5.58>
ST_3 : Operation 11 [1/1] (0.00ns)   --->   "%sext_ln44 = sext i16 %shift_reg_load" [E:/robot/project/xilinx_fpga_class/hls/lab4_zynq_z2/fir.c:44]   --->   Operation 11 'sext' 'sext_ln44' <Predicate = true> <Delay = 0.00>
ST_3 : Operation 12 [1/1] (5.58ns)   --->   "%mul_ln44 = mul i25 %sext_ln44, i25 33554054" [E:/robot/project/xilinx_fpga_class/hls/lab4_zynq_z2/fir.c:44]   --->   Operation 12 'mul' 'mul_ln44' <Predicate = true> <Delay = 5.58> <CoreInst = "Multiplier">   --->   Core 3 'Multiplier' <Latency = 0> <II = 1> <Delay = 5.58> <FuncUnit> <Opcode : 'mul'> <InPorts = 2> <OutPorts = 1>

State 4 <SV = 3> <Delay = 2.05>
ST_4 : Operation 13 [1/1] (1.00ns)   --->   "%x_read = read i16 @_ssdm_op_Read.s_axilite.i16, i16 %x"   --->   Operation 13 'read' 'x_read' <Predicate = true> <Delay = 1.00> <CoreInst = "s_axilite">   --->   Core 112 's_axilite' <Latency = 0> <II = 1> <Delay = 1.00> <Adapter> <Opcode : 'read' 'write'>
ST_4 : Operation 14 [2/2] (1.58ns)   --->   "%call_ln44 = call void @fir_Pipeline_loop, i25 %mul_ln44, i31 %acc_2_loc, i16 %shift_reg, i16 %c" [E:/robot/project/xilinx_fpga_class/hls/lab4_zynq_z2/fir.c:44]   --->   Operation 14 'call' 'call_ln44' <Predicate = true> <Delay = 1.58> <CoreType = "Generic">   --->   Generic Core
ST_4 : Operation 15 [1/1] (0.00ns)   --->   "%sext_ln52 = sext i16 %x_read" [E:/robot/project/xilinx_fpga_class/hls/lab4_zynq_z2/fir.c:52]   --->   Operation 15 'sext' 'sext_ln52' <Predicate = true> <Delay = 0.00>
ST_4 : Operation 16 [3/3] (1.05ns) (grouped into DSP with root node acc)   --->   "%mul_ln52 = mul i26 %sext_ln52, i26 67108486" [E:/robot/project/xilinx_fpga_class/hls/lab4_zynq_z2/fir.c:52]   --->   Operation 16 'mul' 'mul_ln52' <Predicate = true> <Delay = 1.05> <CoreInst = "DSP48">   --->   Core 116 'DSP48' <Latency = 3> <II = 1> <Delay = 2.15> <IPBlock> <Opcode : '' 'add' 'sub' 'mul' 'select'> <InPorts = 0> <OutPorts = 1> <Sync> <CReg>

State 5 <SV = 4> <Delay = 2.10>
ST_5 : Operation 17 [1/2] (2.10ns)   --->   "%call_ln44 = call void @fir_Pipeline_loop, i25 %mul_ln44, i31 %acc_2_loc, i16 %shift_reg, i16 %c" [E:/robot/project/xilinx_fpga_class/hls/lab4_zynq_z2/fir.c:44]   --->   Operation 17 'call' 'call_ln44' <Predicate = true> <Delay = 2.10> <CoreType = "Generic">   --->   Generic Core
ST_5 : Operation 18 [2/3] (1.05ns) (grouped into DSP with root node acc)   --->   "%mul_ln52 = mul i26 %sext_ln52, i26 67108486" [E:/robot/project/xilinx_fpga_class/hls/lab4_zynq_z2/fir.c:52]   --->   Operation 18 'mul' 'mul_ln52' <Predicate = true> <Delay = 1.05> <CoreInst = "DSP48">   --->   Core 116 'DSP48' <Latency = 3> <II = 1> <Delay = 2.15> <IPBlock> <Opcode : '' 'add' 'sub' 'mul' 'select'> <InPorts = 0> <OutPorts = 1> <Sync> <CReg>

State 6 <SV = 5> <Delay = 2.32>
ST_6 : Operation 19 [1/1] (0.00ns)   --->   "%acc_2_loc_load = load i31 %acc_2_loc" [E:/robot/project/xilinx_fpga_class/hls/lab4_zynq_z2/fir.c:48]   --->   Operation 19 'load' 'acc_2_loc_load' <Predicate = true> <Delay = 0.00>
ST_6 : Operation 20 [1/3] (0.00ns) (grouped into DSP with root node acc)   --->   "%mul_ln52 = mul i26 %sext_ln52, i26 67108486" [E:/robot/project/xilinx_fpga_class/hls/lab4_zynq_z2/fir.c:52]   --->   Operation 20 'mul' 'mul_ln52' <Predicate = true> <Delay = 0.00> <CoreInst = "DSP48">   --->   Core 116 'DSP48' <Latency = 3> <II = 1> <Delay = 2.15> <IPBlock> <Opcode : '' 'add' 'sub' 'mul' 'select'> <InPorts = 0> <OutPorts = 1> <Sync> <CReg>
ST_6 : Operation 21 [1/1] (0.00ns) (grouped into DSP with root node acc)   --->   "%sext_ln52_1 = sext i26 %mul_ln52" [E:/robot/project/xilinx_fpga_class/hls/lab4_zynq_z2/fir.c:52]   --->   Operation 21 'sext' 'sext_ln52_1' <Predicate = true> <Delay = 0.00>
ST_6 : Operation 22 [2/2] (2.10ns) (root node of the DSP)   --->   "%acc = add i31 %acc_2_loc_load, i31 %sext_ln52_1" [E:/robot/project/xilinx_fpga_class/hls/lab4_zynq_z2/fir.c:52]   --->   Operation 22 'add' 'acc' <Predicate = true> <Delay = 2.10> <CoreInst = "DSP48">   --->   Core 116 'DSP48' <Latency = 3> <II = 1> <Delay = 2.15> <IPBlock> <Opcode : '' 'add' 'sub' 'mul' 'select'> <InPorts = 0> <OutPorts = 1> <Sync> <CReg>
ST_6 : Operation 23 [1/1] ( I:2.32ns O:2.32ns )   --->   "%store_ln53 = store i16 %x_read, i16 0" [E:/robot/project/xilinx_fpga_class/hls/lab4_zynq_z2/fir.c:53]   --->   Operation 23 'store' 'store_ln53' <Predicate = true> <Delay = 2.32> <CoreInst = "RAM">   --->   Core 81 'RAM' <Latency = 1> <II = 1> <Delay = 2.32> <Storage> <Opcode : 'load' 'store'> <Ports = 2> <Width = 16> <Depth = 58> <RAM>

State 7 <SV = 6> <Delay = 3.10>
ST_7 : Operation 24 [1/1] (0.00ns)   --->   "%spectopmodule_ln31 = spectopmodule void @_ssdm_op_SpecTopModule, void @empty_6" [E:/robot/project/xilinx_fpga_class/hls/lab4_zynq_z2/fir.c:31]   --->   Operation 24 'spectopmodule' 'spectopmodule_ln31' <Predicate = true> <Delay = 0.00>
ST_7 : Operation 25 [1/1] (0.00ns)   --->   "%specbitsmap_ln0 = specbitsmap void @_ssdm_op_SpecBitsMap, i16 %y"   --->   Operation 25 'specbitsmap' 'specbitsmap_ln0' <Predicate = true> <Delay = 0.00>
ST_7 : Operation 26 [1/1] (0.00ns)   --->   "%specinterface_ln0 = specinterface void @_ssdm_op_SpecInterface, i16 %y, void @empty, i32 4294967295, i32 4294967295, void @empty_0, i32 0, i32 0, void @empty_1, void @empty_2, void @empty_3, i32 0, i32 0, i32 0, i32 0, void @empty_3, void @empty_3, i32 4294967295, i32 0, i32 0"   --->   Operation 26 'specinterface' 'specinterface_ln0' <Predicate = true> <Delay = 0.00>
ST_7 : Operation 27 [1/1] (0.00ns)   --->   "%specinterface_ln0 = specinterface void @_ssdm_op_SpecInterface, i16 %y, void @empty_4, i32 4294967295, i32 4294967295, void @empty_3, i32 0, i32 0, void @empty_3, void @empty_3, void @empty_3, i32 0, i32 0, i32 0, i32 0, void @empty_3, void @empty_3, i32 4294967295, i32 0, i32 0"   --->   Operation 27 'specinterface' 'specinterface_ln0' <Predicate = true> <Delay = 0.00>
ST_7 : Operation 28 [1/1] (0.00ns)   --->   "%specbitsmap_ln0 = specbitsmap void @_ssdm_op_SpecBitsMap, i16 %x"   --->   Operation 28 'specbitsmap' 'specbitsmap_ln0' <Predicate = true> <Delay = 0.00>
ST_7 : Operation 29 [1/1] (0.00ns)   --->   "%specinterface_ln0 = specinterface void @_ssdm_op_SpecInterface, i16 %x, void @empty, i32 4294967295, i32 4294967295, void @empty_0, i32 0, i32 0, void @empty_1, void @empty_5, void @empty_3, i32 0, i32 0, i32 0, i32 0, void @empty_3, void @empty_3, i32 4294967295, i32 0, i32 0"   --->   Operation 29 'specinterface' 'specinterface_ln0' <Predicate = true> <Delay = 0.00>
ST_7 : Operation 30 [1/1] (0.00ns)   --->   "%specinterface_ln0 = specinterface void @_ssdm_op_SpecInterface, i16 %x, void @empty_4, i32 4294967295, i32 4294967295, void @empty_3, i32 0, i32 0, void @empty_3, void @empty_3, void @empty_3, i32 0, i32 0, i32 0, i32 0, void @empty_3, void @empty_3, i32 4294967295, i32 0, i32 0"   --->   Operation 30 'specinterface' 'specinterface_ln0' <Predicate = true> <Delay = 0.00>
ST_7 : Operation 31 [1/1] (0.00ns)   --->   "%specinterface_ln0 = specinterface void @_ssdm_op_SpecInterface, i32 0, void @empty, i32 0, i32 0, void @empty_3, i32 0, i32 0, void @empty_1, void @empty_3, void @empty_3, i32 0, i32 0, i32 0, i32 0, void @empty_3, void @empty_3, i32 4294967295, i32 0, i32 0"   --->   Operation 31 'specinterface' 'specinterface_ln0' <Predicate = true> <Delay = 0.00>
ST_7 : Operation 32 [1/2] (2.10ns) (root node of the DSP)   --->   "%acc = add i31 %acc_2_loc_load, i31 %sext_ln52_1" [E:/robot/project/xilinx_fpga_class/hls/lab4_zynq_z2/fir.c:52]   --->   Operation 32 'add' 'acc' <Predicate = true> <Delay = 2.10> <CoreInst = "DSP48">   --->   Core 116 'DSP48' <Latency = 3> <II = 1> <Delay = 2.15> <IPBlock> <Opcode : '' 'add' 'sub' 'mul' 'select'> <InPorts = 0> <OutPorts = 1> <Sync> <CReg>
ST_7 : Operation 33 [1/1] (0.00ns)   --->   "%trunc_ln1 = partselect i16 @_ssdm_op_PartSelect.i16.i31.i32.i32, i31 %acc, i32 15, i32 30" [E:/robot/project/xilinx_fpga_class/hls/lab4_zynq_z2/fir.c:54]   --->   Operation 33 'partselect' 'trunc_ln1' <Predicate = true> <Delay = 0.00>
ST_7 : Operation 34 [1/1] (1.00ns)   --->   "%write_ln54 = write void @_ssdm_op_Write.s_axilite.i16P0A, i16 %y, i16 %trunc_ln1" [E:/robot/project/xilinx_fpga_class/hls/lab4_zynq_z2/fir.c:54]   --->   Operation 34 'write' 'write_ln54' <Predicate = true> <Delay = 1.00> <CoreInst = "s_axilite">   --->   Core 112 's_axilite' <Latency = 0> <II = 1> <Delay = 1.00> <Adapter> <Opcode : 'read' 'write'>
ST_7 : Operation 35 [1/1] (0.00ns)   --->   "%ret_ln55 = ret" [E:/robot/project/xilinx_fpga_class/hls/lab4_zynq_z2/fir.c:55]   --->   Operation 35 'ret' 'ret_ln55' <Predicate = true> <Delay = 0.00>


============================================================
+ Verbose Summary: Timing violations
============================================================
Target clock period: 10.000ns, clock uncertainty: 2.700ns.

 <State 1>: 0.000ns
The critical path consists of the following:

 <State 2>: 2.322ns
The critical path consists of the following:
	'load' operation 16 bit ('shift_reg_load', E:/robot/project/xilinx_fpga_class/hls/lab4_zynq_z2/fir.c:47) on array 'shift_reg' [15]  (2.322 ns)

 <State 3>: 5.580ns
The critical path consists of the following:
	'mul' operation 25 bit ('mul_ln44', E:/robot/project/xilinx_fpga_class/hls/lab4_zynq_z2/fir.c:44) [17]  (5.580 ns)

 <State 4>: 2.050ns
The critical path consists of the following:
	s_axi read operation ('x') on port 'x' [5]  (1.000 ns)
	'mul' operation 26 bit of DSP[23] ('mul_ln52', E:/robot/project/xilinx_fpga_class/hls/lab4_zynq_z2/fir.c:52) [21]  (1.050 ns)

 <State 5>: 2.100ns
The critical path consists of the following:
	'call' operation 0 bit ('call_ln44', E:/robot/project/xilinx_fpga_class/hls/lab4_zynq_z2/fir.c:44) to 'fir_Pipeline_loop' [18]  (2.100 ns)

 <State 6>: 2.322ns
The critical path consists of the following:
	'store' operation 0 bit ('store_ln53', E:/robot/project/xilinx_fpga_class/hls/lab4_zynq_z2/fir.c:53) of variable 'x' on array 'shift_reg' [24]  (2.322 ns)

 <State 7>: 3.100ns
The critical path consists of the following:
	'add' operation 31 bit of DSP[23] ('acc', E:/robot/project/xilinx_fpga_class/hls/lab4_zynq_z2/fir.c:52) [23]  (2.100 ns)
	s_axi write operation ('write_ln54', E:/robot/project/xilinx_fpga_class/hls/lab4_zynq_z2/fir.c:54) on port 'y' (E:/robot/project/xilinx_fpga_class/hls/lab4_zynq_z2/fir.c:54) [26]  (1.000 ns)


============================================================
+ Verbose Summary: Binding
============================================================
N/A
* FSMD analyzer results:
  - Output states:
 - Input state : 
  - Chain level:
	State 1
	State 2
	State 3
	State 4
	State 5
	State 6
	State 7


============================================================
+ Verbose Summary: Datapath Resource usage 
============================================================
N/A
